{"adapter_config_sha256":"565890fadd461093d5e50686b252085d2c9eb63fe20308200dcc384f740a3e58","adapter_id":"local-json-v1","files":[{"encoding":"grounding-cjson-v0.1","path":"source.json","sha256":"3d5cd7258f457cb3e1c25e25d5d5c2aebdb9f6fb0688002e31d1503f0367c801"},{"encoding":"grounding-cjson-v0.1","path":"adapter-config.json","sha256":"565890fadd461093d5e50686b252085d2c9eb63fe20308200dcc384f740a3e58"}],"item_identity_rule_id":"explicit-tuple-v1","revision_policy_id":"opaque-equality-v1","scope_policy_id":"reference-public-v1","source_id":"help-notes","source_revision":"edition:blue","v":1}